{
  "request_id": "req_netgsm_call_confirmation_create_fixture_1",
  "provider": "netgsm",
  "operation": "call.confirmation.create",
  "direction": "outbound",
  "channel": "voice",
  "occurred_at": "2026-10-05T00:00:00.000Z",
  "payload": {
    "order_public_id": "ord_fixture_1",
    "telefon": "05550000000",
    "idempotency_key": "teyit-arama-ord_fixture_1"
  },
  "legacy_contract": {
    "source": "server.js POST /api/netgsm/siparis-arama",
    "fixture_name": "netgsm_call_confirmation_create_minimal"
  }
}
