{
  "request_id": "req_netgsm_call_confirmation_status_fixture_1",
  "provider": "netgsm",
  "operation": "call.confirmation.status",
  "direction": "outbound",
  "channel": "voice",
  "occurred_at": "2026-10-05T00:00:00.000Z",
  "payload": {
    "order_public_id": "ord_fixture_1",
    "bulk_id": "1234567"
  },
  "legacy_contract": {
    "source": "server.js GET /api/netgsm/siparis-arama/durum/:siparisId",
    "fixture_name": "netgsm_call_confirmation_status_minimal"
  }
}
